tests/fixtures/candles/fixtures/update.json

{"channel":"ohlc","type":"update","timestamp":"2023-10-04T16:26:30.524394914Z","data":[{"symbol":"MATIC/USD","open":0.5624,"high":0.5628,"low":0.5622,"close":0.5627,"trades":12,"volume":30927.68066226,"vwap":0.5626,"interval_begin":"2023-10-04T16:25:00.000000000Z","interval":5,"timestamp":"2023-10-04T16:30:00.000000Z"}]}

AGENTS.md

## nomagique

{
    "channel": "ohlc",
    "type": "update",
    "timestamp": "2023-10-04T16:26:30.524394914Z",
    "data": [
        {
            "symbol": "MATIC/USD",
            "open": 0.5624,
            "high": 0.5628,
            "low": 0.5622,
            "close": 0.5627,
            "trades": 12,
            "volume": 30927.68066226,
            "vwap": 0.5626,
            "interval_begin": "2023-10-04T16:25:00.000000000Z",
            "interval": 5,
            "timestamp": "2023-10-04T16:30:00.000000Z"
        }
    ]
}